"Colorado Historical Maps","Map of the State of Colorado","","State of Colorado","","","","","","United States. General Land Office","","United States. General Land Office","","","http://id.loc.gov/authorities/names/n80125848","King, Harry","","King, Harry (Harold G. R.)","","http://id.loc.gov/authorities/names/no2002013804","Dinsmore, A. F.","","Dinsmore, A. F.","http://id.loc.gov/authorities/names/no89009637","Hendges, M.","","Hendges, M.","http://id.loc.gov/authorities/names/no2008061362","","","","cartographic image","map","http://id.loc.gov/vocabulary/marcgt/map","marcgt","Baltimore (Md.)","Geographic","http://id.loc.gov/authorities/names/n79006530","Friedenwald Co. Photo.-Lith","","","1897","","","","","","","","","","","English","eng","ISO639-2","text","cartographic material","lcgft","image/jp2","1 map: color; 71 x 86 cm, on sheet 82 x 97 cm","reformatted digital","","Relief shown by shading.","Shows roads, towns, forest reserves, land offices and natural features.","","","","","","","","","","","","","","","","","","","","","Colorado (United States, North America) (first order administrative divisions)","http://id.loc.gov/authorities/names/n80125532","","","","","","","","","","","Maps","lcgft","Scale 1:760,320, 1 inch = 12 miles","","","","","W 109°--W 102°/N 41°--N 37°","","","","","","","","","","","maps_coHistorical_King_1897.jp2","local","Catalog record: http://libraries.colorado.edu/record=b7400010~S3","Jerry Crail Johnson Earth Sciences & Map Library","current","G4310 1897 .U5","","Material is believed to be in the public domain. However, other rights and restrictions may apply, such as privacy and publicity rights. User is responsible for compliance with all applicable laws. For information about copyright law, please see https://www.cusys.edu/DigitalLibrary/copyright.html.","","","","28","4545","maps_coHistorical_King_1897.jp2","https://cudl.colorado.edu//luna/servlet/detail/CUB~13~13~28~151303"
"Colorado Historical Maps","Map of the state of Colorado showing the coal and metalliferous areas","","State of Colorado Showing the Coal and Metalliferous Areas","","","","","","Colorado. Bureau of Mines","","Colorado. Bureau of Mines","","","http://id.loc.gov/authorities/names/n85159029","Dinsmore, A. F.","","Dinsmore, A. F.","","http://id.loc.gov/authorities/names/no89009637","Bauman, Wm.","","Bauman, Wm. (William)","http://id.loc.gov/authorities/names/no2002013802","Hills, R. C.","1848-1923","Hills, R. C. (Richard Charles), 1848-1923","http://id.loc.gov/authorities/names/no2008048073","Smith-Brooks Co.","Smith-Brooks Co.","http://id.loc.gov/authorities/names/no2008039396","cartographic image","map","http://id.loc.gov/vocabulary/marcgt/map","marcgt","[Denver (Colo.)]","Geographic","http://id.loc.gov/authorities/names/n79055157","[Bureau of Mines?]","","","1910","","","","","","","","","","","English","eng","ISO639-2","text","cartographic material","lcgft","image/jp2","1 map: color; 73 x 85 cm","reformatted digital","","Contents: [Main map] -- Pueblo, Colorado -- City of Denver -- Cripple Creek.","Relief shown by shading.","Shows coal, metalliferous areas, and railroads.","[Longitude] ""West from Washington.""--Bottom border.","Includes 3 insets.","""Coal areas presented by R. C. Hills.""--Below legend.","","","","","","","","Coal--Colorado--Maps","","","","","","Mines and mineral resources--Colorado--Maps","Railroads--Colorado--Maps","lcsh","Colorado (United States, North America) (first order administrative divisions)","http://id.loc.gov/authorities/names/n80125532","","","","","","","","","","","Maps","lcgft","Scale 1:665,280, 1 inch to 10.5 miles","","","","","W 109°--W 102°/N 41°--37°","","","","","","","","","","","maps_coHistorical_Coal_1910.jp2","local","Catalog record: http://libraries.colorado.edu/record=b10022101~S3","Jerry Crail Johnson Earth Sciences & Map Library","current","G4311.H1 1910 .C63","","Material is believed to be in the public domain. However, other rights and restrictions may apply, such as privacy and publicity rights. User is responsible for compliance with all applicable laws. For information about copyright law, please see https://www.cusys.edu/DigitalLibrary/copyright.html.","","","","14","4545","maps_coHistorical_Coal_1910.jp2","https://cudl.colorado.edu//luna/servlet/detail/CUB~13~13~14~151307"
"Colorado Historical Maps","","","Map of Ward Mining District, Boulder County Colorado","","","","","Map of Ward Mining District, Boulder County Colo.","Ward, W. S.","","Ward, W. S. (William Shaw)","","","","Union Pacific, Denver, and Gulf Railway Company. Passenger Department.","","","","http://id.loc.gov/authorities/names/n88224540","","","","","","","","","","","","cartographic image","map","http://id.loc.gov/vocabulary/marcgt/map","marcgt","[Denver (Colo.)]","Geographic","http://id.loc.gov/authorities/names/n79055157","[Union Pacific, Denver & Gulf Railway Co.?]","","","Between 1890 and 1898","","","","","","","","","","","English","eng","ISO639-2","text","cartographic material","lcgft","image/jp2","1 map; 35 x 35 cm, folded to 20 x 9 cm","reformatted digital","","Relief shown by hachures.","Date derived from existence of Union Pacific, Denver & Gulf Railway Co. (1890-1898).","Map folded and attached to inside front cover of booklet, The Ward Mining District, by W. S. Ward, published by the Union Pacific, Denver & Gulf Railway Co., between 1890 and 1898.","CU Libraries copy of map stamped on verso: ""State Historical and Natural History Society, Denver, Colo. Oct. 1, 1897 presented by [blank].""","","","","","","","","Mines and mineral resources--Colorado--Boulder County--Maps","","","","","","","","","","lcsh","Ward Mine (Boulder, Colorado, United States, North America) (mine)","GNIS: 1683770","","","","","","","","","","","Maps","lcgft","Scale not given.","","","","","W 105°30'36""/N 40°4'20""","Boulder County (Colorado, United States, North America) (civil)","GNIS: 198122","","","","","The Ward Mining District, Boulder County, Colorado: a brief description, together with a topographical map showing location of leading mines and prospects","text","TN24.C6 .W33 1890","Catalog record: http://libraries.colorado.edu/record=b8574554~S3","maps_coHistorical_wardMiningDist_map_d.jp2","local","Catalog record: http://libraries.colorado.edu/record=b10154100~S3","Jerry Crail Johnson Earth Sciences & Map Library","current","G4313.B6H2 1890 .W3","","Material is believed to be in the public domain. However, other rights and restrictions may apply, such as privacy and publicity rights. User is responsible for compliance with all applicable laws. For information about copyright law, please see https://www.cusys.edu/DigitalLibrary/copyright.html.","","","","74","4557","maps_coHistorical_wardMiningDist_map_d.jp2","https://cudl.colorado.edu//luna/servlet/detail/CUB~13~13~74~189754"
"Colorado Historical Maps","Map showing rainfall areas of Colorado","Rainfall map of Colorado","","","","","","","Clason Map Co.","","Clason Map Co.","","","http://id.loc.gov/authorities/names/nr98013404","Colorado. State Board of Immigration","","Colorado. State Board of Immigration","","http://id.loc.gov/authorities/names/nr95016393","","","","","","","","","","","","cartographic image","map","http://id.loc.gov/vocabulary/marcgt/map","marcgt","Denver (Colo.)","Geographic","http://id.loc.gov/authorities/names/n79055157","The Company","","","1919","","","","","","","","","","","English","eng","ISO639-2","text","cartographic material","lcgft","image/jp2","1 map : color ; 43 x 55 cm folded to 24 x 10 cm","reformatted digital","","Folded title: Rainfall map of Colorado","Relief shown by hachures","Shows areas with various ranges of rainfall and average annual-statistics for some locations","Rainfall data from the U.S. Weather Bureau"," Includes index to cities and towns, keyed to location on map","Date taken from index title","Rainfall, farming and financial statistics for 1917 and 1918 on verso"," Inset on verso: Wheat map of Colorado, 1919","Map Library copy is blank on verso","","","","","","","","","","","Rain and rainfall--Colorado--Maps","Rain and rainfall","lcsh","Colorado (United States, North America) (first order administrative divisions)","http://id.loc.gov/authorities/names/n80125532","","","","","","","","","","","Maps","lcgft","Scale approximately 1:1,225,00","","","","","(W 109°--W 102°/N 41°--N 37°)","","","","","","","","","","","maps_coHistorical_rainfallAreas_1919_d.jpg","local","Catalog record: https://libraries.colorado.edu/record=b7909812","Jerry Crail Johnson Earth Sciences & Map Library","current","G4311.C883 1919 .C5","","The organization that has made the Item available believes that the Item is in the Public Domain under the laws of the United States, but a determination was not made as to its copyright status under the copyright laws of other countries. The Item may not be in the Public Domain under the laws of other countries. Please refer to the organization that has made the Item available for more information. URI: http://rightsstatements.org/vocab/NoC-US/1.0/","","","","136","4742","maps_coHistorical_rainfallAreas_1919_d.jpg","https://cudl.colorado.edu//luna/servlet/detail/CUB~13~13~136~232476"
"Colorado Historical Maps","Map showing unappropriated government lands in western Nebraska and South Platte Valley, Colorado","","Panel title: Free government lands in western Nebraska and South Platte Valley, Colorado on Union Pacific","","","","","","Union Pacific Railroad Company","","Union Pacific Railroad Company","","","http://id.loc.gov/authorities/names/n81029000","Lomax, E. L.","1852-1916","Lomax, E. L. (Edward Lloyd), 1852-1916","","http://id.loc.gov/authorities/names/n00077692","","","","","","","","","","","","cartographic image","map","http://id.loc.gov/vocabulary/marcgt/map","marcgt","Omaha (Neb.)","Geographic","http://id.loc.gov/authorities/names/n79045127","Union Pacific Railroad","","","[1909?]","","","","","","","","","","","English","eng","ISO639-2","text","cartographic material","lcgft","image/jp2","1 map ; 44 x 91cm, folded to 23 x 11 cm, on sheet 46 x 91 cm","reformatted digital","","""7-25-09-50M""--Verso, panel 14","Shows Township plats, lands open to settlement, Union Pacific Railroad route, with E. L. Lomax, General Passenger Agent, Union Pacific Railroad Co., Omaha, Nebraska, as contact for further information. Also shows part of counties in northwest Kansas and most of Laramie County, Wyoming","Text and illustrations on verso regarding how to obtain title to public lands under the Homestead Law and other laws. Includes power of attorney form and list of agencies with contact names for information on how to reach the land","Verso panels with title have blue coloring","Map Library instruction","","","","","","","","Public land sales--West (U.S.)","Homestead law--United States","Public lands--Colorado--Maps","Railroads--West (U.S.)--Map","","Public lands--Nebraska--Maps","","Public lands--Kansas--Maps","Public lands--Wyoming--Laramie County--Maps","lcsh","","","","","","","","","","","","","Maps","lcgft","Scale not given","","","","","(W 105°18'00""--W 99°57'00""/N 41°54'00""--N 39°47'00"")","","","","","","","","","","","maps_coHistorical_1909_unappGovtLands.jp2","local","Catalog record: https://libraries.colorado.edu/record=b9077355","Jerry Crail Johnson Earth Sciences & Map Library","current","G4191.G5 1909 .U5","","The organization that has made the Item available believes that the Item is in the Public Domain under the laws of the United States, but a determination was not made as to its copyright status under the copyright laws of other countries. The Item may not be in the Public Domain under the laws of other countries. Please refer to the organization that has made the Item available for more information. URI: http://rightsstatements.org/vocab/NoC-US/1.0/","","","","196","4742","maps_coHistorical_1909_unappGovtLands_b.jp2|maps_coHistorical_1909_unappGovtLands.jp2",""
"Colorado Historical Maps","Map of Cripple Creek gold mining district ","","","","","","","","Williamson-Haffner Co.","","Williamson-Haffner Co.","","additional author","http://id.loc.gov/authorities/names/nr2006009026","","","","","","","","","","","","","","","","","cartographic image","map","http://id.loc.gov/vocabulary/marcgt/map","marcgt","Colorado Springs (Colo.)","Geographic","http://id.loc.gov/authorities/names/n79084870","William P. Bonright & Co.","","","[1895]","","","","","","","","","","","English","eng","ISO639-2","text","cartographic material","lcgft","image/jp2","1 map ; 29 x 22 cm","reformatted digital","","Relief shown by spot heights and pictorially","""Copyrighted July, 1895.""","Shows railroads, towns, and mines to the north, east, and south of the town of Cripple Creek","""Williamson-Haffner Eng. Co., Denver""--Lower right border","""Note. The numbers indicate height in feet above tide water""--Below title","","","","","","","","","","","","","","","Gold mines and mining--Colorado--Teller County--Maps","Mines and mineral resources--Colorado--Cripple Creek-Victor Gold Mining District--Maps","lcsh","Cripple Creek District Mine (Teller, Colorado, United States, North America) (mine)","GNIS: 1735389","","","","","","","","","","","Maps","lcgft","Scale not given","","","","","(W 105°11'15""--W 105°06'00""/N 38°47'10""--N 38°42'10"")","Teller County (Colorado, United States, North America) (civil)","GNIS: 198175","","","","","","","","","maps_coHistorical_1895July_CrippleCrGold_d.jpg","local","Catalog record: https://libraries.colorado.edu/record=b10248106","Jerry Crail Johnson Earth Sciences & Map Library","current","G4313.T4H2 1895 .M3","","The organization that has made the Item available believes that the Item is in the Public Domain under the laws of the United States, but a determination was not made as to its copyright status under the copyright laws of other countries. The Item may not be in the Public Domain under the laws of other countries. Please refer to the organization that has made the Item available for more information. URI: http://rightsstatements.org/vocab/NoC-US/1.0/","","","","112","4742","maps_coHistorical_1895July_CrippleCrGold_d.jpg","https://cudl.colorado.edu//luna/servlet/detail/CUB~13~13~112~232483"
"Colorado Historical Maps","Map of the town of De Beque, Mesa County, Colorado","","Map of the town of DeBeque, Mesa County, Colorado","","","","","","","","","","","","","","","","","","","","","","","","","","","","cartographic image","map","http://id.loc.gov/vocabulary/marcgt/map","marcgt","[Colorado?]","Geographic","ttp://id.loc.gov/authorities/names/n80125532","[publisher not identified]","","","[1900?]","","","","","","","","","","","English","eng","ISO639-2","text","cartographic material","lcgft","image/jp2","1 map ; 51 x 45 cm, on sheet 58 x 49 cm","reformatted digital","","Date derived from absence of Colorado Midland & D. & R. G. R. R. present on 1904 Sanborn fire insurance map at 2nd St. and Winter Ave","Shows block and lot numbers from Rhone Ave. in the west to Rouse Ave. in the east, and from 9th St. in the north to Park Grounds and Grand River in the south",""" N.E. Cor Sec 28""--at top at 9th St. ""1/4 Cor E side Sec 28. T. 8 S. R. 97 W""--lower right near 2nd St","","","","","","","","","Real property--Colorado--De Beque--Maps","","","","","","","","","","lcsh","De Beque (Mesa, Colorado, United States, North America) (populated place)","GNIS: 174334","","","","","","","","","","","Maps","lcgft","Scale approximately 1:2,200. 200 ft. to 1 in.","","","","","(W 108°13'13""--W 108°12'40""/N 39°20'15""--N 39°19'45"")","","","","","","","","","","","maps_coHistorical_debequeMesaCounty.jp2","local","Catalog record: https://libraries.colorado.edu/record=b10308538","Jerry Crail Johnson Earth Sciences & Map Library","current","G4314.D22G46 1900 .M3","","The organization that has made the Item available reasonably believes that the Item is not restricted by copyright or related rights, but a conclusive determination could not be made. Please refer to the organization that has made the Item available for more information. You are free to use this Item in any way that is permitted by the copyright and related rights legislation that applies to your use. URI: http://rightsstatements.org/vocab/NKC/1.0/http://rightsstatements.org/vocab/NKC/1.0/","","","","156","4742","maps_coHistorical_debequeMesaCounty.jp2","https://cudl.colorado.edu//luna/servlet/detail/CUB~13~13~156~223195"
"Colorado Historical Maps","Midget mileage map of the best roads of Colorado","Showing paved roads, road distances","Midget road map of Colorado","","","","","","Clason Map Co.","","Clason Map Co.","","","http://id.loc.gov/authorities/names/nr98013404","Clason, George S.","1874-1957","Clason, George S. (George Samuel), 1874-1957","","http://id.loc.gov/authorities/names/no94002083","","","","","","","","","","","","cartographic image","map","http://id.loc.gov/vocabulary/marcgt/map","marcgt","Denver (Colo.)","Geographic","http://id.loc.gov/authorities/names/n79055157","Clason Map Co.","","","[between 1925 and 1926?]","","","","","","","","","","","English","eng","ISO639-2","text","cartographic material","lcgft","image/jp2","1 map ; 20 x 26 cm, folded in cover to 8 x 5 cm","reformatted digital","","Relief shown by hachures and spot heights","Date derived from presence of road over Monarch Pass, completed 1922, and lack of road up to Mount Evans, completed 1927. Nation-wide  system  of  numbered  highways, initiated in 1924, not yet present","""Copyrighted the C. M. Co.""--Lower left","""Compliments of Motor Specialties Co. ... Denver, Colo. Distributors of the Warford auxiliary transmission for all Fords""--Cover","","","","","","","","","","","","","","","","Roads--Colorado--Maps","Roads","lcsh","Colorado (United States, North America) (first order administrative divisions)","http://id.loc.gov/authorities/names/n80125532","","","","","","","","","","","Maps","lcgft","Scale approximately 1:2,500,000","","","","","(W 109°03'00""--W 102°02'00""/N 41°00'00""--N 36°59'00"")","","","","","","","","","","","maps_coHistorical_1925_midgetMilageMap.jp2","local","Catalog record: https://libraries.colorado.edu/record=b10849644","Jerry Crail Johnson Earth Sciences & Map Library","current","G4311.P2 1925 .C5","","This Item is protected by copyright and/or related rights. You are free to use this Item in any way that is permitted by the copyright and related rights legislation that applies to your use. For other uses you need to obtain permission from the rights-holder(s). URI: http://rightsstatements.org/vocab/InC/1.0/","","","","202","4742","maps_coHistorical_1925_midgetMilageMap_b.jp2|maps_coHistorical_1925_midgetMilageMap_c.jp2|maps_coHistorical_1925_midgetMilageMap.jp2",""
"Colorado Historical Maps","Mining map of Boulder County, Colorado","Showing patented claims according to final official surveys","","","","","","","Rollandet, G. J.","","","","","","","","","","","","","","","","","","","","","","cartographic image","map","http://id.loc.gov/vocabulary/marcgt/map","marcgt","Denver (Colo.)","Geographic","http://id.loc.gov/authorities/names/n79055157","G.J. Rollandet","","","1894","","","","","","Denver (Colo.)","Geographic","http://id.loc.gov/authorities/names/n79055157","Denver Lith. Company","1894","English","eng","ISO639-2","text","cartographic material","lcgft","image/jp2","1 map ; 56 x 81 cm, on sheet 65 x 103 cm","reformatted digital","","Includes index, advertising, and 5 inset maps","Inset maps: Section 8, T.1 S., R.73 W. -- [Section 27] -- [Balarat claim] -- Sec. 12 -- Sec 20 and 29, T. 1 S., R.71 W","","","","","","","","","","","Mining claims--Colorado--Boulder County--Maps","Mines and mineral resources--Colorado--Boulder County--Maps","","","","","","Mines and mineral resources","Mining claims","lcsh","Boulder County (Colorado, United States, North America) (civil)","fast","","","","","","","","","","","Maps","lcgft","Scale approximately 1:36,000","","","","","","","fast","","fast","","fast","","","","","maps_coHistorical_boulderMining1894.jp2","local","Catalog record: https://libraries.colorado.edu/record=b6603355","Jerry Crail Johnson Earth Sciences & Map Library","current","G4313.B6H1 1894 .R66","","The organization that has made the Item available believes that the Item is in the Public Domain under the laws of the United States, but a determination was not made as to its copyright status under the copyright laws of other countries. The Item may not be in the Public Domain under the laws of other countries. Please refer to the organization that has made the Item available for more information. URI: http://rightsstatements.org/vocab/NoC-US/1.0/","","","","153","4742","maps_coHistorical_boulderMining1894.jp2","https://cudl.colorado.edu//luna/servlet/detail/CUB~13~13~153~223201"
"Colorado Historical Maps","Nebraska and Kanzas","","Nebraska and Kansas","","","","","","J.H. Colton & Co.","","J.H. Colton & Co.","cartographer","","http://id.loc.gov/authorities/names/n83052525","","","","","","","","","","","","","","","","","cartographic image","map","http://id.loc.gov/vocabulary/marcgt/map","marcgt","New York (State)","Geographic","http://id.loc.gov/authorities/names/n80126293","Published by J.H. Colton & Co.","","","[1855]","","","","","","","","","","","English","eng","ISO639-2","text","cartographic material","lcgft","image/jp2","1 map : hand colored ; 29 x 36 cm, on sheet 39 x 47 cm","reformatted digital","","Relief shown by hachures","Shows routes explored for Pacific railroad by Captain J.W. Gunnison and Lieutenant E.G. Beckwith; shows route for a proposed railroad to the West Coast as Governor Stevens' Route & line of proposed Pacific railroad; and adjacent portions of neighboring states. Hand colored in pink to define territory and state boundaries","""Published by J.H. Colton & Co. Number 172 William St. New York.; Entered according to Act of Congress in the year 1855 by J.H. Colton & Co. in the Clerks Office of the District Court of the United Stated for the Southern District of New York.""","Prime meridians: Greenwich and Washington","Includes notes","At lower right: Number 50","C.U. Libraries copy includes separate sheet of text describing Nebraska, Kansas, Idian, etc., Territories","Available also through the Library of Congress Web site as a raster image","","","","","","","","","","","","","","","Kansas (United States, North America) (first order administrative divisions)","http://id.loc.gov/authorities/names/n79007369","","","","","","","","","","","Maps","lcgft","Scale approximately 1:4,900,000","","","","","(W 113°--W 93°/N 48°--N 38°)","Nebraska (United States, North America) (first order administrative divisions)","http://id.loc.gov/authorities/names/n80072484","","","","","","","","","maps_coHistorical_1855_NebraskaKanzas_d.jp2","local","Catalog record: https://libraries.colorado.edu/record=b10816111","Jerry Crail Johnson Earth Sciences & Map Library","current","G4190 1855 .J4","","The organization that has made the Item available believes that the Item is in the Public Domain under the laws of the United States, but a determination was not made as to its copyright status under the copyright laws of other countries. The Item may not be in the Public Domain under the laws of other countries. Please refer to the organization that has made the Item available for more information. URI: http://rightsstatements.org/vocab/NoC-US/1.0/","","","","198","4742","maps_coHistorical_1855_NebraskaKanzas_d.jp2","https://cudl.colorado.edu//luna/servlet/detail/CUB~13~13~198~232454"
"Colorado Historical Maps","Nell's new topographical & township map of the State of Colorado","","New topographical and township map of the state of Colorado","","","","","","Nell, Louis","","Nell, Louis","cartographers","","http://id.loc.gov/authorities/names/n50028440","","","","","","","","","","","","","","","","","cartographic image","map","http://id.loc.gov/vocabulary/marcgt/map","marcgt","Washington (D.C.)","Geographic","http://id.loc.gov/authorities/names/n79018774","Chain & Hardy","","","1880","","","","","","Denver (Colo.)","Geographic","http://id.loc.gov/authorities/names/n79055157","","","English","eng","ISO639-2","text","cartographic material","lcgft","image/jp2","1 map: color; 95 x 70 cm, folded to 16 x 11 cm","reformatted digital","","Relief shown by contours, hachures and spot heights.","Includes tables for counties, astronomical positions, and arable land.","""Stone & Co. General agents for Colorado"" inked out and replaced with Chain & Hardy stamp.","""A. M. Photo-Litho Co. N.Y. (Osborne's process.)""--Lower left margin.","","","","","","","","","","","","","","","","","","","Colorado (United States, North America) (first order administrative divisions)","http://id.loc.gov/authorities/names/n80125532","","","","","","","","Topographic maps","Maps","","","lcgft","Scale 1:665,280, 1 inch to 10.5 miles","","","","","W 109°03'00""--W 102°02'00""/N 41°00'00""--N 36°59'00""","","","","","","","","","","","maps_coHistorical_Nells_1880_01.jp2","local","Catalog record: http://libraries.colorado.edu/record=b10022807~S3","Jerry Crail Johnson Earth Sciences & Map Library","current","G4310 1880 .N4","","Material is believed to be in the public domain. However, other rights and restrictions may apply, such as privacy and publicity rights. User is responsible for compliance with all applicable laws. For information about copyright law, please see https://www.cusys.edu/DigitalLibrary/copyright.html.","","","","17","4545","maps_coHistorical_Nells_1880_01.jp2","https://cudl.colorado.edu//luna/servlet/detail/CUB~13~13~17~151302"
