"Colorado Historical Maps","Nell's topographical map of the state of Colorado","","Nell's map of Colorado","","","","","","Nell, Louis","","Nell, Louis","cartographers","","http://id.loc.gov/authorities/names/n50028440","Kendrick Book & Stationery Co.","","Kendrick Book & Stationery Co.","","http://id.loc.gov/authorities/names/no2018011209","Friedenwald Co.","","Friedenwald Co.","http://id.loc.gov/authorities/names/n2007059551","","","","","","","","cartographic image","map","http://id.loc.gov/vocabulary/marcgt/map","marcgt","Denver (Colo.)","Geographic","http://id.loc.gov/authorities/names/n79055157","Kendrick Book & Stationery Co.","","","","1903","1907","","","","","","","","","English","eng","ISO639-2","text","cartographic material","lcgft","image/jp2","1 map: color; 98 x 73 cm folded in covers to 19 x 12 cm + 12 pages","reformatted digital","","Relief shown by hachures, contours, and spot heights.","Shows township grid, counties, roads, railroads, reservoirs, forest reserves, Indian reservations, agricultural lands mostly irrigated, U.S. Land offices, canals, and notable physical features.","Includes index in accompanying pages and explanation.","""Copyright by Louis Nell, Denver, Colo. 1903.""","In lower left margin: ""The Friedenwald Co. photo-lith. Balto.""","CU Libraries copy lacks covers and accompanying pages with index.","Date on top of map is 1907, text in lower right corner indicates copyright by Louis Nell, Denver, Colo., 1903.","","","","","","Reservoirs--Colorado--Maps","Forest reserves--Colorado--Maps","Indian reservations--Colorado--Maps","Canals--Colorado--Maps","Public lands--Colorado--Maps","Counties--Colorado--Maps","","Roads--Colorado--Maps","Railroads--Colorado--Maps","lcsh","Colorado (United States, North America) (first order administrative divisions)","http://id.loc.gov/authorities/names/n80125532","","","","","","","","Physical maps","Topographic maps","Maps","","lcgft","Scale [1:633,600], 1 inch = 10 miles","","","","","W 109°00'--W 102°00'/N 41°00'--N 37°00'","","","","","","","","","","","maps_coHistorical_Nells_1907.jp2","local","Catalog record: http://libraries.colorado.edu/record=b10022826~S3","Jerry Crail Johnson Earth Sciences & Map Library","current","G4310 1907 .N4","","Material is believed to be in the public domain. However, other rights and restrictions may apply, such as privacy and publicity rights. User is responsible for compliance with all applicable laws. For information about copyright law, please see https://www.cusys.edu/DigitalLibrary/copyright.html.","","","","27","4545","maps_coHistorical_Nells_1907.jp2","https://cudl.colorado.edu//luna/servlet/detail/CUB~13~13~27~151317"
"Colorado Historical Maps","Nell's topographical map of the state of Colorado","","Nell's map of Colorado","","","","","","Nell, Louis","","Nell, Louis","cartographers","","http://id.loc.gov/authorities/names/n50028440","Friedenwald Co.","","","","","Hamilton & Kendrick","","Hamilton & Kendrick","http://id.loc.gov/authorities/names/no2018010968","","","","","","","","cartographic image","map","http://id.loc.gov/vocabulary/marcgt/map","marcgt","Denver (Colo.)","Geographic","http://id.loc.gov/authorities/names/n79055157","Hamilton & Kendrick","","","","1901","1902","","","","","","","","","English","eng","ISO639-2","text","cartographic material","lcgft","image/jp2","1 map: color; 73 x 101 cm, folded in cover 19 x 12 cm","reformatted digital","","Relief shown by contours, hachures and spot heights.","Shows county seats, reservations and private land grants, U.S. Land Offices, irrigation canals, and timber reserves.","Includes index (8 pages) bound into dark red cover. Index lists counties and post offices with population, and highest mountains in Colorado with altitude. Cover has title ""Nell's map of Colorado"" stamped in gilt.","""Copyright by Louis Nell, Denver, Colo. 1901.""--Lower right margin.","""The Friedenwald Co., photo-lith., Balto.""--Lower left margin","","","","","","","","","","","","","","","Forest reserves--Colorado--Maps","Canals--Colorado--Maps","lcsh","Colorado (United States, North America) (first order administrative divisions)","http://id.loc.gov/authorities/names/n80125532","","","","","","","","Physical maps","Topographic maps","Maps","","lcgft","Scale 1:633,600 1 in. to approximately 10 miles","","","","","W 109°00'--W 102°00'/N 41°00'--N 37°00'","","","","","","","","","","","maps_coHistorical_nellsColorado1902.jp2","local","Catalog record: http://libraries.colorado.edu/record=b10163613~S3","Jerry Crail Johnson Earth Sciences & Map Library","current","G4310 1902 .N4","","Material is believed to be in the public domain. However, other rights and restrictions may apply, such as privacy and publicity rights. User is responsible for compliance with all applicable laws. For information about copyright law, please see https://www.cusys.edu/DigitalLibrary/copyright.html.","","","","86","4638","maps_coHistorical_nellsColorado1902.jp2|maps_coHistorical_nellsColorado1902_index.pdf",""
"Colorado Historical Maps","Oil map of Colorado","Showing the proved oil fields, oil shale deposits, location of anticlinal structures, oil and gas seepages--and other indications of oil and gas","","","","","","","George, Russell D.","1866-","George, Russell D., 1866-","","","http://id.loc.gov/authorities/names/n87813986","Colorado Geological Survey","","Colorado Geological Survey","","http://id.loc.gov/authorities/names/n78083372","","","","","","","","","","","","cartographic image","map","http://id.loc.gov/vocabulary/marcgt/map","marcgt","Boulder (Colo.)","Geographic","http://id.loc.gov/authorities/names/n79091289","Colorado State Geological Survey","","","1924","","","","","","","","","","","English","eng","ISO639-2","text","cartographic material","lcgft","image/jp2","1 map : blue line print ; 67 x 80 cm","reformatted digital","","""H.A.[D.] 5-12-1919""--Lower right border","""Colorado State Geological Survey. R. D. George, State Geologist (Boulder, Colorado)""--Upper left margin","MSS Collection #513, map number 63","","","","","","","","","","","","","","","","","Oil fields--Colorado--Maps","Oil fields","lcsh","Colorado (United States, North America) (first order administrative divisions)","http://id.loc.gov/authorities/names/n80125532","","","","","","","","","","","Maps","lcgft","Scale approximately 1:810,000","","","","","(W 109°07ʹ--W 102°/N 41°--N 37°)","","","","","","","","","","","maps_coHistorical_RDGeorgeOil_1919b_d.jpg","local","Catalog record: https://libraries.colorado.edu/record=b10022862","Jerry Crail Johnson Earth Sciences & Map Library","current","G4311.H8 1924 .G4","","The organization that has made the Item available believes that the Item is in the Public Domain under the laws of the United States, but a determination was not made as to its copyright status under the copyright laws of other countries. The Item may not be in the Public Domain under the laws of other countries. Please refer to the organization that has made the Item available for more information. URI: http://rightsstatements.org/vocab/NoC-US/1.0/","","","","123","4742","maps_coHistorical_RDGeorgeOil_1919b_d.jpg","https://cudl.colorado.edu//luna/servlet/detail/CUB~13~13~123~232474"
"Colorado Historical Maps","Oil map of Colorado showing the proved oil fields, oil shale deposits, location of anticlinal structures, oil and gas seepages--and other indications of oil and gas","","","","","","","","George, Russell D.","1866-","George, Russell D., 1866-","","","http://id.loc.gov/authorities/names/n87813986","Colorado Geological Survey","","Colorado Geological Survey","","http://id.loc.gov/authorities/names/n78083372","","","","","","","","","","","","cartographic image","map","http://id.loc.gov/vocabulary/marcgt/map","marcgt","Boulder (Colo.)","Geographic","http://id.loc.gov/authorities/names/n79091289","Colorado State Geological Survey","","","1924","","","","","Revised 1924","","","","","","English","eng","ISO639-2","text","cartographic material","lcgft","image/jp2","1 map: blue line print; 67 x 80 cm","reformatted digital","","""H.A.[D.] 5-12-1919""--Lower right border.","""Colorado State Geological Survey. R. D. George, State Geologist (Boulder, Colorado)""--Upper left margin.","MSS Collection #513, map number 63.","","","","","","","","","Oil fields--Colorado--Maps","","","","","","","","","","lcsh","Colorado (United States, North America) (first order administrative divisions)","http://id.loc.gov/authorities/names/n80125532","","","","","","","","","","","Maps","lcgft","Scale approximately 1:810,000","","","","","W 109°07'--W 102°/N 41°--N 37°","","","","","","","","","","","maps_coHistorical_Oil.jp2","local","Catalog record: http://libraries.colorado.edu/record=b10022862~","Jerry Crail Johnson Earth Sciences & Map Library","current","G4311.H8 1924 .G4","","Copyright and other restrictions may apply. User is responsible for compliance with all applicable laws. For information about copyright law, please see https://www.cusys.edu/DigitalLibrary/copyright.html.","","","","13","4545","maps_coHistorical_Oil.jp2","https://cudl.colorado.edu//luna/servlet/detail/CUB~13~13~13~151316"
"Colorado Historical Maps","Oil map of Colorado","Showing the proved oil fields, oil shale deposits, location of anticlinal structures, oil and gas seepages--and other indications of oil and gas","","","","","","","George, Russell D.","1866-","George, Russell D., 1866-","","","http://id.loc.gov/authorities/names/n87813986","Colorado Geological Survey","","Colorado Geological Survey","","http://id.loc.gov/authorities/names/n78083372","","","","","","","","","","","","cartographic image","map","http://id.loc.gov/vocabulary/marcgt/map","marcgt","Boulder (Colo.)","Geographic","http://id.loc.gov/authorities/names/n79091289","Colorado State Geological Survey","","","1919","","","","","","","","","","","English","eng","ISO639-2","text","cartographic material","lcgft","image/jp2","1 map : photocopy ; 61 x 80 cm","reformatted digital","","Blue line print, positive","Shows county seats and county borders"," ""H.A.[D.] 5-12-1919""--Lower right border","""Colorado State Geological Survey. R. D. George, State Geologist (Boulder, Colorado)""--Upper left margin","","","","","","","","","","","","","","","","Oil fields--Colorado--Maps","Oil fields","lcsh","Colorado (United States, North America) (first order administrative divisions)","http://id.loc.gov/authorities/names/n80125532","","","","","","","","","","","Maps","lcgft","Scale approximately 1:810,000","","","","","(W 109°--W 102°/N 41°--N 37°)","","","","","","","","","","","maps_coHistorical_RDGeorgeOil_1919_d.jpg","local","Catalog record: https://libraries.colorado.edu/record=b10815985","Jerry Crail Johnson Earth Sciences & Map Library","current","G4311.H8 1919 .G4","","The organization that has made the Item available believes that the Item is in the Public Domain under the laws of the United States, but a determination was not made as to its copyright status under the copyright laws of other countries. The Item may not be in the Public Domain under the laws of other countries. Please refer to the organization that has made the Item available for more information. URI: http://rightsstatements.org/vocab/NoC-US/1.0/","","","","121","4742","maps_coHistorical_RDGeorgeOil_1919_d.jpg","https://cudl.colorado.edu//luna/servlet/detail/CUB~13~13~121~232475"
"Colorado Historical Maps","Oil map of Colorado showing the proved oil fields, oil shale deposits, location of anticlinal structures, oil and gas seepages and other indications of oil and gas","","","","","","","","George, Russell D.","1866-","George, Russell D., 1866-","","","http://id.loc.gov/authorities/names/n87813986","Colorado Geological Survey","","Colorado Geological Survey","","http://id.loc.gov/authorities/names/n78083372","","","","","","","","","","","","cartographic image","map","http://id.loc.gov/vocabulary/marcgt/map","marcgt","Boulder (Colo.)","Geographic","http://id.loc.gov/authorities/names/n79091289","Colorado State Geological Survey","","","1925","","","","","","","","","","","English","eng","ISO639-2","text","cartographic material","lcgft","image/jp2","1 map : blueline print ; 62 x 80 cm","reformatted digital","","Blueline print","""H.A.D. 5-12-1919""--Lower right border","""Colorado State Geological Survey. R. D. Georg, State Geologist (Boulder, Colorado)""--Upper left margin","""This map is not intended as an accurate or complete presentation of the oil and gas possibilities of the state of Colorado but merely to bring together and direct attention to some facts which may aid in the development of these resources. Many indications of both oil and gas are reported which for lack of definite information are not recorded on the present map and perhaps some as shown here are inaccurate.""--Upper right margin","","","","","","","","","","Petroleum--Colorado--Maps","","","","","","Oil fields--Colorado--Maps","Petroleum","lcsh","Colorado (United States, North America) (first order administrative divisions)","http://id.loc.gov/authorities/names/n80125532","","","","","","","","Maps","Thematic maps","","","lcgft","Scale approximately 1:800,000","","","","","(W 109°07ʹ--W 102°00ʹ/N 41°00ʹ--N 37°00ʹ)","","","","","","","","","","","maps_coHistorical_RDGeorgeOil_1925b_d.jpg","local","Catalog record: https://libraries.colorado.edu/record=b10806660","Jerry Crail Johnson Earth Sciences & Map Library","current","G4311.H8 1925 .G46","","The organization that has made the Item available believes that the Item is in the Public Domain under the laws of the United States, but a determination was not made as to its copyright status under the copyright laws of other countries. The Item may not be in the Public Domain under the laws of other countries. Please refer to the organization that has made the Item available for more information. URI: http://rightsstatements.org/vocab/NoC-US/1.0/","","","","122","4742","maps_coHistorical_RDGeorgeOil_1925b_d.jpg","https://cudl.colorado.edu//luna/servlet/detail/CUB~13~13~122~232473"
"Colorado Historical Maps","Pikes peak and vicinity","","Topographic map of Pikes Peak and vicinity, Colorado","","","","","","Geological Survey (U.S.)","","Geological Survey (U.S.)","","","http://id.loc.gov/authorities/names/n80092173","","","","","","","","","","","","","","","","","cartographic image","map","http://id.loc.gov/vocabulary/marcgt/map","marcgt","Washington (D.C.)","Geographic","http://id.loc.gov/authorities/names/n79018774","The Survey","","","1956","","","","","","","","","","","English","eng","ISO639-2","text","cartographic material","lcgft","image/jp2","1 map: color; 66 x 75 cm","reformatted digital","","Contents: Verso: The geologic story of Pikes Peak and the surrounding region. Topography -- Geology -- Geologic time -- Geologic history -- Suggested reading.","Relief shown by shading, contours and spot heights.","""This map is available in both shaded relief and contour editions.""","""Interior-Geological Survey, Washington, D.C.-1957-NS-MR-4183.""","Includes text, pictures, diagrams, and notes on verso.","Includes bibliographical references.","","","","","","","","","","","","","","","","","Pikes Peak (El Paso, Colorado, United States, North America) (summit)","GNIS: 204770","","","","","","","","Physical maps","Maps","","","lcgft","Scale 1:62,500","","","","","W 105°12'--W 104°41'/N 39°03'--N 38°42'","El Paso County (Colorado, United States, North America) (civil)","GNIS: 198135","Teller County (Colorado, United States, North America) (civil)","GNIS: 198175","Colorado Springs (El Paso, Colorado, United States, North America) (populated place)","GNIS: 204797","","","","","maps_coHistorical_pikesPeak_001_front_d.jp2","local","Catalog record: http://libraries.colorado.edu/record=b9009343~S3","Jerry Crail Johnson Earth Sciences & Map Library","current","G4312.P5C2 1956 .U5","","Copyright and other restrictions may apply. User is responsible for compliance with all applicable laws. For information about copyright law, please see https://www.cusys.edu/DigitalLibrary/copyright.html.","","","","15","4545","maps_coHistorical_pikesPeak_001_back_d.jp2|maps_coHistorical_pikesPeak_001_front_d.jp2",""
"Colorado Historical Maps","Plan, profile, and damsites, Navajo River, Colorado and New Mexico, mouth to vicinity of Fall Creek ; Rio Amargo to mile 15.6","","","Navajo River, Colorado and New Mexico, mouth to vicinity of Fall Creek ; Rio Amargo to mile 15.6"," Navajo River, Colorado and New Mexico, 1955","","","","Geological Survey (U.S.)","","Geological Survey (U.S.)","","","http://id.loc.gov/authorities/names/n80092173","","","","","","","","","","","","","","","","","cartographic image","map","http://id.loc.gov/vocabulary/marcgt/map","marcgt","Washington (D.C.)","Geographic","http://id.loc.gov/authorities/names/n79018774","Interior--Geological Survey","","","1955-58","","","","","","","","","","","English","eng","ISO639-2","text","cartographic material","lcgft","image/jp2","6 maps : color ; each 46 x 64 cm","reformatted digital","","Relief shown by contours and spot heights","Sheet 5 includes: Upper Oso Damsite -- Rio Amargo Damsite -- Lower Oso Damsite -- Edith Damsite. Sheet 6 shows 4 sections","CU Libraries holds Sheet 1 only","""Mapped, edited, and published by the Geological Survey.""","""Control by USGS and USC&GS.""","""Topography from aerial photographs by Kelsh plotter. Aerial photographs taken 1952. Field checked 1955 [-57].""","""Contour interval on land 20 feet. Contour interval on river surface 5 feet. Datum is mean sea level.""","""Interior-Geological Survey. Washington, D.C.-1961-NS M.R. 4881.""","""Improved roads shown by solid lines; unimproved roads shown by dashed lines.""","Shows ranges and townships","Maps numbered sheet 1 through sheet 6, each with ""Location map.""","","","","","","","","","Water resources development--Colorado--Archuleta County--Maps","Water resources development--New Mexico--Rio Arriba County--Maps","lcsh","Navajo River (Archuleta, Colorado, United States, North America) (stream)","GNIS: 184550","","","","","","","","Maps","Topographic maps","","","lcgft","Scale 1:24,000 or 1 in. = 2000 ft.","","","","","(W 107°10ʹ--W 106°40ʹ/N 37°11ʹ--N 36°54ʹ)","","","","","","","","","","","maps_coHistorical_navajoRiverDamsites_1955_d.jpg","local","Catalog record: https://libraries.colorado.edu/record=b10161668","Jerry Crail Johnson Earth Sciences & Map Library","current","G4312.N25 C222 1955 .U5","","The organization that has made the Item available believes that the Item is in the Public Domain under the laws of the United States, but a determination was not made as to its copyright status under the copyright laws of other countries. The Item may not be in the Public Domain under the laws of other countries. Please refer to the organization that has made the Item available for more information. URI: http://rightsstatements.org/vocab/NoC-US/1.0/","","","","129","4742","maps_coHistorical_navajoRiverDamsites_1955_d.jpg","https://cudl.colorado.edu//luna/servlet/detail/CUB~13~13~129~232477"
"Colorado Historical Maps","Prather's aerial view of the Rocky Mountain National, Estes, Park [Colorado] ","","","","","","","","","","","","","","","","","","","","","","","","","","","","","","cartographic image","map","http://id.loc.gov/vocabulary/marcgt/map","marcgt","","Geographic","http://id.loc.gov/authorities/names/n79018774","","","","","","","","","","","","","","","English","eng","ISO639-2","text","cartographic material","lcgft","","","reformatted digital","","","","","","","","","","","","","","","","","","","","","","","lcsh","","","","","","","","","","","","","Maps","lcgft","","","","","","","","","","","","","","","","","maps_coHistorical_prathersRMN1922.jp2","","Catalog record: https://libraries.colorado.edu/record=b9520348","Jerry Crail Johnson Earth Sciences & Map Library","current","G4312.R6A5 1922 .P3","","[Copyright and other restrictions may apply. User is responsible for compliance with all applicable laws. For information about copyright law, please see https://www.cusys.edu/DigitalLibrary/copyright.html.]","","","","164","4742","maps_coHistorical_prathersRMN1922.jp2","https://cudl.colorado.edu//luna/servlet/detail/CUB~13~13~164~287172"
"Colorado Historical Maps","Rand, McNally & Co.'s Colorado","","Rand, McNally & Company's Colorado","","","","","","Rand McNally and Company","","Rand McNally and Company","","","http://id.loc.gov/authorities/names/n79150315","","","","","","","","","","","","","","","","","cartographic image","map","http://id.loc.gov/vocabulary/marcgt/map","marcgt","Chicago (Ill.)","Geographic","http://id.loc.gov/authorities/names/n78086438","Rand, McNally & Co.","","","1906","","","","","","","","","","","English","eng","ISO639-2","text","cartographic material","lcgft","image/jp2","1 map: color; 46 x 65 cm, on sheet 54 x 72 cm, folded in cover 17 x 11 cm","reformatted digital","","Relief shown by hachures and spot heights.","""Rand, McNally & Co. ... 1906"" at bottom margin. ""Copyright, 1905, by Randy, McNally & Co."" below bar scale.","Includes index to chief cities with population in thousands.","Shows drainage, settlements, townships, counties, railroads, etc. Upper left corner has list of Colorado railroads, printed over map in red ink.","""Rand, McNally & Co.'s new business atlas of Colorado.""--Lower left.","""Rand, McNally & Co.'s series of indexed pocket maps""--Back cover.","CU Libraries copy has back cover attached but lacks front cover.","","","","","Railroads--Colorado--Maps","","","","","","","","","","lcsh","Colorado (United States, North America) (first order administrative divisions)","http://id.loc.gov/authorities/names/n80125532","","","","","","","","","","","Maps","lcgft","Scale approximately 1:1,013,760. 16 miles = 1 in","","","","","W 109°07ʹ--W 102°00ʹ/N 41°00ʹ--N 37°ʹ","","","","","","","","","","","maps_coHistorical_randMcNally1906_front_d.jp2","local","Catalog record: http://libraries.colorado.edu/record=b10132779~S3","Jerry Crail Johnson Earth Sciences & Map Library","current","G4310 1906 .R3","","Material is believed to be in the public domain. However, other rights and restrictions may apply, such as privacy and publicity rights. User is responsible for compliance with all applicable laws. For information about copyright law, please see https://www.cusys.edu/DigitalLibrary/copyright.html.","","","","68","4557","maps_coHistorical_randMcNally1906_front_d.jp2|maps_coHistorical_randMcNally1906_back_d.jp2",""
"Colorado Historical Maps","Reference map of the State of Colorado","","","","","","","","Williamson-Haffner Co.","","Williamson-Haffner Co.","","","http://id.loc.gov/authorities/names/nr2006009026","","","","","","","","","","","","","","","","","cartographic image","map","http://id.loc.gov/vocabulary/marcgt/map","marcgt","Denver (Colo.)","Geographic","http://id.loc.gov/authorities/names/n79055157","Williamson-Haffner Eng. Co.","","","1910","","","","","","","","","","","English","eng","ISO639-2","text","cartographic material","lcgft","image/jp2","1 map: color; 37 x 49 cm, on sheet 44 x 64 cm, folded to 14 x 8 cm","reformatted digital","","Relief shown by hachures.","Includes ""key to map"" index of cities and towns.","Shows towns, roads, railroads, land grants, natural features, township and range.","","","","","","","","","","","","","","","","","","","lcsh","Colorado (United States, North America) (first order administrative divisions)","http://id.loc.gov/authorities/names/n80125532","","","","","","","","","","","Maps","lcgft","Scale approximately 1:1,330,560","","","","","W 109°03'00""--W 102°02'00""/N 41°00'00""--N 36°59'00""","","","","","","","","","","","maps_coHistorical_refWillHaffner1910_front_d.jp2","local","Catalog record: http://libraries.colorado.edu/record=b10132672~S3","Jerry Crail Johnson Earth Sciences & Map Library","current","G4310 1910 .W5","","Material is believed to be in the public domain. However, other rights and restrictions may apply, such as privacy and publicity rights. User is responsible for compliance with all applicable laws. For information about copyright law, please see https://www.cusys.edu/DigitalLibrary/copyright.html.","","","","62","4557","maps_coHistorical_refWillHaffner1910_front_d.jp2","https://cudl.colorado.edu//luna/servlet/detail/CUB~13~13~62~189740"
